SiteNumber, SiteName, SiteLongitude, SiteLatitude, SiteNWISURL
1477800,"SHELLPOT CREEK AT WILMINGTON, DE",-75.5186944,39.7609722,https://waterdata.usgs.gov/nwis/inventory?agency_code=USGS&site_no=01477800
1478000,"CHRISTINA RIVER AT COOCHS BRIDGE, DE",-75.72788889,39.63738889,https://waterdata.usgs.gov/nwis/inventory?agency_code=USGS&site_no=01478000
1478650,"WHITE CLAY CREEK AT NEWARK, DE",-75.74875,39.6892222,https://waterdata.usgs.gov/nwis/inventory?agency_code=USGS&site_no=01478650
1479000,"WHITE CLAY CREEK NEAR NEWARK, DE",-75.67502778,39.6992222,https://waterdata.usgs.gov/nwis/inventory?agency_code=USGS&site_no=01479000
1480000,"RED CLAY CREEK AT WOODDALE, DE",-75.6365,39.76280556,https://waterdata.usgs.gov/nwis/inventory?agency_code=USGS&site_no=01480000
1480015,"RED CLAY CREEK NEAR STANTON, DE",-75.6399444,39.71575,https://waterdata.usgs.gov/nwis/inventory?agency_code=USGS&site_no=01480015
1480017,"RED CLAY CREEK TRIBUTARY AT MARSHALLTON, DE",-75.6518611,39.72741667,https://waterdata.usgs.gov/nwis/inventory?agency_code=USGS&site_no=01480017
1480065,"CHRISTINA RIVER AT NEWPORT, DE",-75.6087222,39.71063889,https://waterdata.usgs.gov/nwis/inventory?agency_code=USGS&site_no=01480065
1480120,"CHRISTINA RIVER AT WILMINGTON, DE",-75.5405556,39.7360833,https://waterdata.usgs.gov/nwis/inventory?agency_code=USGS&site_no=01480120
1481500,"BRANDYWINE CREEK AT WILMINGTON, DE",-75.5766944,39.7695,https://waterdata.usgs.gov/nwis/inventory?agency_code=USGS&site_no=01481500
1482170,"DELAWARE RIVER AT NEW CASTLE, DE",-75.562,39.65680556,https://waterdata.usgs.gov/nwis/inventory?agency_code=USGS&site_no=01482170
1483155,"SILVER LAKE TRIBUTARY AT MIDDLETOWN, DE",-75.7094722,39.4309722,https://waterdata.usgs.gov/nwis/inventory?agency_code=USGS&site_no=01483155
1483200,"BLACKBIRD CREEK AT BLACKBIRD, DE",-75.66938889,39.36627778,https://waterdata.usgs.gov/nwis/inventory?agency_code=USGS&site_no=01483200
1483500,"LEIPSIC RIVER NEAR CHESWOLD, DE",-75.6323056,39.2328611,https://waterdata.usgs.gov/nwis/inventory?agency_code=USGS&site_no=01483500
1483510,"GARRISONS LAKE NEAR CHESWOLD, DE",-75.58838889,39.24430556,https://waterdata.usgs.gov/nwis/inventory?agency_code=USGS&site_no=01483510
1483700,"ST JONES RIVER AT DOVER, DE",-75.5190833,39.1637222,https://waterdata.usgs.gov/nwis/inventory?agency_code=USGS&site_no=01483700
1484000,"MURDERKILL RIVER NEAR FELTON, DE",-75.5669167,38.97602778,https://waterdata.usgs.gov/nwis/inventory?agency_code=USGS&site_no=01484000
1484080,"MURDERKILL RIVER AT FREDERICA, DE",-75.4583056,39.0105,https://waterdata.usgs.gov/nwis/inventory?agency_code=USGS&site_no=01484080
1484085,"MURDERKILL RIVER AT BOWERS, DE",-75.3976111,39.05830556,https://waterdata.usgs.gov/nwis/inventory?agency_code=USGS&site_no=01484085
1484100,"BEAVERDAM BRANCH AT HOUSTON, DE",-75.51275,38.90577778,https://waterdata.usgs.gov/nwis/inventory?agency_code=USGS&site_no=01484100
1484143,"HAVEN LAKE OUTLET AT MILFORD, DE",-75.4441667,38.91291667,https://waterdata.usgs.gov/nwis/inventory?agency_code=USGS&site_no=01484143
1484235,"CEDAR CREEK NEAR SLAUGHTER BEACH, DE",-75.3236944,38.93502778,https://waterdata.usgs.gov/nwis/inventory?agency_code=USGS&site_no=01484235
1484525,"MILLSBORO POND OUTLET AT MILLSBORO, DE",-75.29102778,38.59455556,https://waterdata.usgs.gov/nwis/inventory?agency_code=USGS&site_no=01484525
1484540,"INDIAN RIVER AT ROSEDALE BEACH, DE",-75.2115833,38.59152778,https://waterdata.usgs.gov/nwis/inventory?agency_code=USGS&site_no=01484540
1484549,"VINES CREEK NEAR DAGSBORO, DE",-75.2031667,38.55638889,https://waterdata.usgs.gov/nwis/inventory?agency_code=USGS&site_no=01484549
1484670,"REHOBOTH BAY AT DEWEY BEACH, DE",-75.0842222,38.6942222,https://waterdata.usgs.gov/nwis/inventory?agency_code=USGS&site_no=01484670
1484683,"INDIAN RIVER BAY INLET NEAR BETHANY BEACH, DE",-75.068,38.6098333,https://waterdata.usgs.gov/nwis/inventory?agency_code=USGS&site_no=01484683
1484690,"UNNAMED DTCH ON FRED HUDSON RD AT BETHANY BCH, DE",-75.0634444,38.55544444,https://waterdata.usgs.gov/nwis/inventory?agency_code=USGS&site_no=01484690
1484695,"BEAVERDAM DITCH NEAR MILLVILLE, DE",-75.13338889,38.52144444,https://waterdata.usgs.gov/nwis/inventory?agency_code=USGS&site_no=01484695
1484696,"JEFFERSON CREEK AT SOUTH BETHANY, DE",-75.0623333,38.51355556,https://waterdata.usgs.gov/nwis/inventory?agency_code=USGS&site_no=01484696
1484701,"LITTLE ASSAWOMAN BAY AT FENWICK ISLAND, DE",-75.0583333,38.4549722,https://waterdata.usgs.gov/nwis/inventory?agency_code=USGS&site_no=01484701
1487000,"NANTICOKE RIVER NEAR BRIDGEVILLE, DE",-75.5618611,38.7283333,https://waterdata.usgs.gov/nwis/inventory?agency_code=USGS&site_no=01487000
1487170,"HEARNS POND NEAR SEAFORD, DE",-75.5944722,38.68005556,https://waterdata.usgs.gov/nwis/inventory?agency_code=USGS&site_no=01487170
1488500,"MARSHYHOPE CREEK NEAR ADAMSVILLE, DE",-75.6731111,38.84969444,https://waterdata.usgs.gov/nwis/inventory?agency_code=USGS&site_no=01488500