7335700,"Kiamichi River near Big Cedar, OK",-94.6127236,34.63843685,https://waterdata.usgs.gov/nwis/inventory?agency_code=USGS&site_no=07335700
7335790,"Kiamichi River near Clayton, OK",-95.3408025,34.5748229,https://waterdata.usgs.gov/nwis/inventory?agency_code=USGS&site_no=07335790
7335840,"Pine Creek at Eubanks, OK",-95.5933306,34.40527778,https://waterdata.usgs.gov/nwis/inventory?agency_code=USGS&site_no=07335840
7336200,"Kiamichi River near Antlers, OK",-95.6052475,34.24871203,https://waterdata.usgs.gov/nwis/inventory?agency_code=USGS&site_no=07336200
7337900,"Glover River near Glover, OK",-94.9021667,34.09760677,https://waterdata.usgs.gov/nwis/inventory?agency_code=USGS&site_no=07337900
7338500,"Little River blw Lukfata Creek, nr Idabel, OK",-94.7585482,33.94122094,https://waterdata.usgs.gov/nwis/inventory?agency_code=USGS&site_no=07338500
7338750,"Mountain Fork at Smithville, OK",-94.6352202,34.4623262,https://waterdata.usgs.gov/nwis/inventory?agency_code=USGS&site_no=07338750
7339000,"Mountain Fork near Eagletown, OK",-94.6199358,34.04177757,https://waterdata.usgs.gov/nwis/inventory?agency_code=USGS&site_no=07339000